{"schema_version":"1","analysis_rev":"fx-0001","producer_commit":"w0-fixture","input_artifact_hashes":{},"cam_id":"fixture_cam-1","chunk_index":0,"chunk_t0_ms":0,"source":"yolo11_coco","rows":[[0,"person",60.0,245.0,88.0,325.0,0.86],[100,"person",65.0,245.0,93.0,325.0,0.86],[200,"person",70.0,245.0,98.0,325.0,0.86],[300,"person",75.0,245.0,103.0,325.0,0.86],[400,"person",80.0,245.0,108.0,325.0,0.86],[500,"person",85.0,245.0,113.0,325.0,0.86],[600,"person",90.0,245.0,118.0,325.0,0.86],[700,"person",95.0,245.0,123.0,325.0,0.86],[800,"person",100.0,245.0,128.0,325.0,0.86],[900,"person",105.0,245.0,133.0,325.0,0.86],[1000,"person",110.0,245.0,138.0,325.0,0.86],[1100,"person",115.0,245.0,143.0,325.0,0.86],[1200,"person",120.0,245.0,148.0,325.0,0.86],[1300,"person",125.0,245.0,153.0,325.0,0.86],[1400,"person",130.0,245.0,158.0,325.0,0.86],[1500,"person",135.0,245.0,163.0,325.0,0.86],[1600,"person",140.0,245.0,168.0,325.0,0.86],[1700,"person",145.0,245.0,173.0,325.0,0.86],[1800,"person",150.0,245.0,178.0,325.0,0.86],[1900,"person",155.0,245.0,183.0,325.0,0.86],[2000,"person",160.0,245.0,188.0,325.0,0.86],[2100,"person",165.0,245.0,193.0,325.0,0.86],[2100,"car",627.0,200.0,639.0,270.0,0.91],[2200,"person",170.0,245.0,198.0,325.0,0.86],[2200,"car",614.0,200.0,639.0,270.0,0.91],[2300,"person",175.0,245.0,203.0,325.0,0.86],[2300,"car",601.0,200.0,639.0,270.0,0.91],[2400,"person",180.0,245.0,208.0,325.0,0.86],[2400,"car",588.0,200.0,639.0,270.0,0.91],[2500,"person",185.0,245.0,213.0,325.0,0.86],[2500,"car",575.0,200.0,639.0,270.0,0.91],[2600,"person",190.0,245.0,218.0,325.0,0.86],[2600,"car",562.0,200.0,639.0,270.0,0.91],[2700,"person",195.0,245.0,223.0,325.0,0.86],[2700,"car",549.0,200.0,639.0,270.0,0.91],[2800,"person",200.0,245.0,228.0,325.0,0.86],[2800,"car",536.0,200.0,639.0,270.0,0.91],[2900,"person",205.0,245.0,233.0,325.0,0.86],[2900,"car",523.0,200.0,639.0,270.0,0.91],[3000,"person",210.0,245.0,238.0,325.0,0.86],[3000,"car",510.0,200.0,630.0,270.0,0.91],[3100,"person",215.0,245.0,243.0,325.0,0.86],[3100,"car",497.0,200.0,617.0,270.0,0.91],[3200,"person",220.0,245.0,248.0,325.0,0.86],[3200,"car",484.0,200.0,604.0,270.0,0.91],[3300,"person",225.0,245.0,253.0,325.0,0.86],[3300,"car",471.0,200.0,591.0,270.0,0.91],[3400,"person",230.0,245.0,258.0,325.0,0.86],[3400,"car",458.0,200.0,578.0,270.0,0.91],[3500,"person",235.0,245.0,263.0,325.0,0.86],[3500,"car",445.0,200.0,565.0,270.0,0.91],[3600,"person",240.0,245.0,268.0,325.0,0.86],[3600,"car",432.0,200.0,552.0,270.0,0.91],[3700,"person",245.0,245.0,273.0,325.0,0.86],[3700,"car",419.0,200.0,539.0,270.0,0.91],[3800,"person",250.0,245.0,278.0,325.0,0.86],[3800,"car",406.0,200.0,526.0,270.0,0.91],[3900,"person",255.0,245.0,283.0,325.0,0.86],[3900,"car",393.0,200.0,513.0,270.0,0.91],[4000,"person",260.0,245.0,288.0,325.0,0.86],[4000,"car",380.0,200.0,500.0,270.0,0.91],[4100,"person",265.0,245.0,293.0,325.0,0.86],[4100,"car",367.0,200.0,487.0,270.0,0.91],[4200,"person",270.0,245.0,298.0,325.0,0.86],[4200,"car",354.0,200.0,474.0,270.0,0.91],[4300,"person",275.0,245.0,303.0,325.0,0.86],[4300,"car",341.0,200.0,461.0,270.0,0.91],[4400,"person",280.0,245.0,308.0,325.0,0.86],[4400,"car",328.0,200.0,448.0,270.0,0.91],[4500,"person",285.0,245.0,313.0,325.0,0.86],[4500,"car",315.0,200.0,435.0,270.0,0.91],[4600,"person",290.0,245.0,318.0,325.0,0.86],[4600,"car",302.0,200.0,422.0,270.0,0.91],[4700,"person",295.0,245.0,323.0,325.0,0.86],[4700,"car",289.0,200.0,409.0,270.0,0.91],[4800,"person",300.0,245.0,328.0,325.0,0.86],[4800,"car",276.0,200.0,396.0,270.0,0.91],[4900,"person",305.0,245.0,333.0,325.0,0.86],[4900,"car",263.0,200.0,383.0,270.0,0.91],[5000,"person",310.0,245.0,338.0,325.0,0.86],[5000,"car",250.0,200.0,370.0,270.0,0.91],[5100,"person",315.0,245.0,343.0,325.0,0.86],[5100,"car",237.0,200.0,357.0,270.0,0.91],[5200,"person",320.0,245.0,348.0,325.0,0.86],[5200,"car",224.0,200.0,344.0,270.0,0.91],[5300,"person",325.0,245.0,353.0,325.0,0.86],[5300,"car",211.0,200.0,331.0,270.0,0.91],[5400,"person",330.0,245.0,358.0,325.0,0.86],[5400,"car",198.0,200.0,318.0,270.0,0.91],[5500,"person",335.0,245.0,363.0,325.0,0.86],[5500,"car",185.0,200.0,305.0,270.0,0.91],[5600,"person",340.0,245.0,368.0,325.0,0.86],[5600,"car",172.0,200.0,292.0,270.0,0.91],[5700,"person",345.0,245.0,373.0,325.0,0.86],[5700,"car",159.0,200.0,279.0,270.0,0.91],[5800,"person",350.0,245.0,378.0,325.0,0.86],[5800,"car",146.0,200.0,266.0,270.0,0.91],[5900,"person",355.0,245.0,383.0,325.0,0.86],[5900,"car",133.0,200.0,253.0,270.0,0.91],[6000,"person",360.0,245.0,388.0,325.0,0.86],[6000,"car",120.0,200.0,240.0,270.0,0.91],[6100,"person",365.0,245.0,393.0,325.0,0.86],[6100,"car",107.0,200.0,227.0,270.0,0.91],[6200,"person",370.0,245.0,398.0,325.0,0.86],[6200,"car",94.0,200.0,214.0,270.0,0.91],[6300,"person",375.0,245.0,403.0,325.0,0.86],[6300,"car",81.0,200.0,201.0,270.0,0.91],[6400,"person",380.0,245.0,408.0,325.0,0.86],[6400,"car",68.0,200.0,188.0,270.0,0.91],[6500,"person",385.0,245.0,413.0,325.0,0.86],[6500,"car",55.0,200.0,175.0,270.0,0.91],[6600,"person",390.0,245.0,418.0,325.0,0.86],[6600,"car",42.0,200.0,162.0,270.0,0.91],[6700,"person",395.0,245.0,423.0,325.0,0.86],[6700,"car",29.0,200.0,149.0,270.0,0.91],[6800,"person",400.0,245.0,428.0,325.0,0.86],[6800,"car",16.0,200.0,136.0,270.0,0.91],[6900,"person",405.0,245.0,433.0,325.0,0.86],[6900,"car",3.0,200.0,123.0,270.0,0.91],[7000,"person",410.0,245.0,438.0,325.0,0.86],[7000,"car",0.0,200.0,110.0,270.0,0.91],[7100,"person",415.0,245.0,443.0,325.0,0.86],[7100,"car",0.0,200.0,97.0,270.0,0.91],[7200,"person",420.0,245.0,448.0,325.0,0.86],[7200,"car",0.0,200.0,84.0,270.0,0.91],[7300,"person",425.0,245.0,453.0,325.0,0.86],[7300,"car",0.0,200.0,71.0,270.0,0.91],[7400,"person",430.0,245.0,458.0,325.0,0.86],[7400,"car",0.0,200.0,58.0,270.0,0.91],[7500,"person",435.0,245.0,463.0,325.0,0.86],[7500,"car",0.0,200.0,45.0,270.0,0.91],[7600,"person",440.0,245.0,468.0,325.0,0.86],[7600,"car",0.0,200.0,32.0,270.0,0.91],[7700,"person",445.0,245.0,473.0,325.0,0.86],[7700,"car",0.0,200.0,19.0,270.0,0.91],[7800,"person",450.0,245.0,478.0,325.0,0.86],[7900,"person",455.0,245.0,483.0,325.0,0.86],[8000,"person",460.0,245.0,488.0,325.0,0.86],[8100,"person",465.0,245.0,493.0,325.0,0.86],[8200,"person",470.0,245.0,498.0,325.0,0.86],[8300,"person",475.0,245.0,503.0,325.0,0.86],[8400,"person",480.0,245.0,508.0,325.0,0.86],[8500,"person",485.0,245.0,513.0,325.0,0.86],[8600,"person",490.0,245.0,518.0,325.0,0.86],[8700,"person",495.0,245.0,523.0,325.0,0.86],[8800,"person",500.0,245.0,528.0,325.0,0.86],[8900,"person",505.0,245.0,533.0,325.0,0.86],[9000,"person",510.0,245.0,538.0,325.0,0.86],[9100,"person",515.0,245.0,543.0,325.0,0.86],[9200,"person",520.0,245.0,548.0,325.0,0.86],[9300,"person",525.0,245.0,553.0,325.0,0.86],[9400,"person",530.0,245.0,558.0,325.0,0.86],[9500,"person",535.0,245.0,563.0,325.0,0.86],[9600,"person",540.0,245.0,568.0,325.0,0.86],[9700,"person",545.0,245.0,573.0,325.0,0.86],[9800,"person",550.0,245.0,578.0,325.0,0.86],[9900,"person",555.0,245.0,583.0,325.0,0.86]]}
